cclab@cclab-HP-280-G3-MT:/media/cclab/AGNELO/LAB PROGRAMS/DBMS/Experiment 10$ sudo /opt/lampp/bin/mysql -u root
[sudo] password for cclab: 
Welcome to the MariaDB monitor.  Commands end with ; or \g.
Your MariaDB connection id is 14
Server version: 10.4.32-MariaDB Source distribution

Copyright (c) 2000, 2018, Oracle, MariaDB Corporation Ab and others.

Type 'help;' or '\h' for help. Type '\c' to clear the current input statement.

MariaDB [(none)]> create database table_trigger;
Query OK, 1 row affected (0.000 sec)

MariaDB [(none)]> USE table_trigger;
Database changed
MariaDB [table_trigger]> CREATE TABLE table1 (a1 INT PRIMARY KEY);
Query OK, 0 rows affected (0.213 sec)

MariaDB [table_trigger]> CREATE TABLE table2 (a2 INT PRIMARY KEY);
Query OK, 0 rows affected (0.184 sec)

MariaDB [table_trigger]> CREATE TABLE table3 (a3 INT PRIMARY KEY);
Query OK, 0 rows affected (0.223 sec)

MariaDB [table_trigger]> CREATE TABLE table4 (a4 INT PRIMARY KEY, b4 INT DEFAULT 0);
Query OK, 0 rows affected (0.338 sec)

MariaDB [table_trigger]> DELIMITER //
MariaDB [table_trigger]> 
MariaDB [table_trigger]> CREATE TRIGGER table1_trigger
    -> AFTER INSERT ON table1
    -> FOR EACH ROW
    -> BEGIN
    ->     INSERT INTO table2 (a2) VALUES (NEW.a1);
    ->     DELETE FROM table3 WHERE a3 = NEW.a1;
    ->     IF EXISTS (SELECT 1 FROM table4 WHERE a4 = NEW.a1) THEN
    ->         UPDATE table4 SET b4 = b4 + 1 WHERE a4 = NEW.a1;
    ->     END IF;
    -> END //
Query OK, 0 rows affected (0.123 sec)

MariaDB [table_trigger]> 
MariaDB [table_trigger]> DELIMITER ;
MariaDB [table_trigger]> INSERT INTO table3 (a3) VALUES (101), (102), (103);
Query OK, 3 rows affected (0.042 sec)
Records: 3  Duplicates: 0  Warnings: 0

MariaDB [table_trigger]> INSERT INTO table4 (a4, b4) VALUES (101, 5), (104, 3);
Query OK, 2 rows affected (0.051 sec)
Records: 2  Duplicates: 0  Warnings: 0

MariaDB [table_trigger]> SELECT * FROM table3;
+-----+
| a3  |
+-----+
| 101 |
| 102 |
| 103 |
+-----+
3 rows in set (0.000 sec)

MariaDB [table_trigger]> SELECT * FROM table1;
Empty set (0.001 sec)

MariaDB [table_trigger]> SELECT * FROM table2;
Empty set (0.001 sec)

MariaDB [table_trigger]> SELECT * FROM table4;
+-----+------+
| a4  | b4   |
+-----+------+
| 101 |    5 |
| 104 |    3 |
+-----+------+
2 rows in set (0.000 sec)

MariaDB [table_trigger]> INSERT INTO table1 (a1) VALUES (101), (102), (104);
Query OK, 3 rows affected (0.316 sec)
Records: 3  Duplicates: 0  Warnings: 0

MariaDB [table_trigger]> SELECT * FROM table1;
+-----+
| a1  |
+-----+
| 101 |
| 102 |
| 104 |
+-----+
3 rows in set (0.000 sec)

MariaDB [table_trigger]> SELECT * FROM table2;
+-----+
| a2  |
+-----+
| 101 |
| 102 |
| 104 |
+-----+
3 rows in set (0.000 sec)

MariaDB [table_trigger]> SELECT * FROM table3;
+-----+
| a3  |
+-----+
| 103 |
+-----+
1 row in set (0.000 sec)

MariaDB [table_trigger]> SELECT * FROM table4;
+-----+------+
| a4  | b4   |
+-----+------+
| 101 |    6 |
| 104 |    4 |
+-----+------+
2 rows in set (0.001 sec)

MariaDB [table_trigger]> -- 2) Create a table emp_proj with empid,number of projects he is working on, total number of hrs. Create another table proj_info with project number,number of employees working on that project,total number of hrs spent on that project.
MariaDB [table_trigger]> 
MariaDB [table_trigger]> USE alex_dbms;
Reading table information for completion of table and column names
You can turn off this feature to get a quicker startup with -A

Database changed
MariaDB [alex_dbms]> CREATE TABLE emp_proj (
    ->     empid INT PRIMARY KEY,
    ->     num_projects INT DEFAULT 0,
    ->     total_hours INT DEFAULT 0
    -> );
Query OK, 0 rows affected (0.218 sec)

MariaDB [alex_dbms]> CREATE TABLE proj_info (
    ->     project_no INT PRIMARY KEY,
    ->     num_employees INT DEFAULT 0,
    ->     total_hours INT DEFAULT 0
    -> );
Query OK, 0 rows affected (0.226 sec)

MariaDB [alex_dbms]> CREATE TABLE works_on (
    ->     empid INT,
    ->     project_no INT,
    ->     hours INT,
    ->     PRIMARY KEY (empid, project_no)
    -> );
Query OK, 0 rows affected (0.215 sec)

MariaDB [alex_dbms]> -- Whenever we delete an entry from the works_on table respective changes must be done to emp_proj and proj_info tables.
MariaDB [alex_dbms]> 
MariaDB [alex_dbms]> DELIMITER //
MariaDB [alex_dbms]> 
MariaDB [alex_dbms]> CREATE TRIGGER works_on_delete_trigger
    -> AFTER DELETE ON works_on
    -> FOR EACH ROW
    -> BEGIN
    ->     UPDATE emp_proj
    ->     SET num_projects = num_projects - 1,
    ->         total_hours = total_hours - OLD.hours
    ->     WHERE empid = OLD.empid;
    -> 
    ->     UPDATE proj_info
    ->     SET num_employees = num_employees - 1,
    ->         total_hours = total_hours - OLD.hours
    ->     WHERE project_no = OLD.project_no;
    -> END //
Query OK, 0 rows affected (0.093 sec)

MariaDB [alex_dbms]> 
MariaDB [alex_dbms]> DELIMITER ;
MariaDB [alex_dbms]> exit;
Bye
cclab@cclab-HP-280-G3-MT:/media/cclab/AGNELO/LAB PROGRAMS/DBMS/Experiment 10$ sudo /opt/lampp/bin/mysqldump table_trigger > table_trigger.sql
cclab@cclab-HP-280-G3-MT:/media/cclab/AGNELO/LAB PROGRAMS/DBMS/Experiment 10$ sudo /opt/lampp/bin/mysql -u root
Welcome to the MariaDB monitor.  Commands end with ; or \g.
Your MariaDB connection id is 17
Server version: 10.4.32-MariaDB Source distribution

Copyright (c) 2000, 2018, Oracle, MariaDB Corporation Ab and others.

Type 'help;' or '\h' for help. Type '\c' to clear the current input statement.

MariaDB [(none)]> create database alex_exp10;
Query OK, 1 row affected (0.000 sec)

MariaDB [(none)]> use alex_expt10;
ERROR 1049 (42000): Unknown database 'alex_expt10'
MariaDB [(none)]> show databases;
+--------------------+
| Database           |
+--------------------+
| EXP3               |
| PRexpt1            |
| alex_dbms          |
| alex_exp10         |
| dbvjeet            |
| ervin              |
| exp2_021           |
| expt1_053          |
| expt1_53           |
| information_schema |
| mysql              |
| parvani            |
| performance_schema |
| phpmyadmin         |
| priya              |
| table_trigger      |
| trial_db           |
+--------------------+
17 rows in set (0.001 sec)

MariaDB [(none)]> use alex_exp10;
Database changed
MariaDB [alex_exp10]> CREATE TABLE emp_proj (
    ->     empid INT PRIMARY KEY,
    ->     num_projects INT DEFAULT 0,
    ->     total_hours INT DEFAULT 0
    -> );
Query OK, 0 rows affected (0.226 sec)

MariaDB [alex_exp10]> CREATE TABLE proj_info (
    ->     project_no INT PRIMARY KEY,
    ->     num_employees INT DEFAULT 0,
    ->     total_hours INT DEFAULT 0
    -> );
Query OK, 0 rows affected (0.199 sec)

MariaDB [alex_exp10]> CREATE TABLE works_on (
    ->     empid INT,
    ->     project_no INT,
    ->     hours INT,
    ->     PRIMARY KEY (empid, project_no)
    -> );
Query OK, 0 rows affected (0.206 sec)

MariaDB [alex_exp10]> -- Whenever we delete an entry from the works_on table respective changes must be done to emp_proj and proj_info tables.
MariaDB [alex_exp10]> DELIMITER //
MariaDB [alex_exp10]> 
MariaDB [alex_exp10]> CREATE TRIGGER works_on_delete_trigger
    -> AFTER DELETE ON works_on
    -> FOR EACH ROW
    -> BEGIN
    ->     UPDATE emp_proj
    ->     SET num_projects = num_projects - 1,
    ->         total_hours = total_hours - OLD.hours
    ->     WHERE empid = OLD.empid;
    -> 
    ->     UPDATE proj_info
    ->     SET num_employees = num_employees - 1,
    ->         total_hours = total_hours - OLD.hours
    ->     WHERE project_no = OLD.project_no;
    -> END //
Query OK, 0 rows affected (0.079 sec)

MariaDB [alex_exp10]> 
MariaDB [alex_exp10]> DELIMITER ;
MariaDB [alex_exp10]> 
MariaDB [alex_exp10]> INSERT INTO emp_proj (empid, num_projects, total_hours) VALUES (1, 2, 40), (2, 1, 20);
Query OK, 2 rows affected (0.044 sec)
Records: 2  Duplicates: 0  Warnings: 0

MariaDB [alex_exp10]> INSERT INTO proj_info (project_no, num_employees, total_hours) VALUES (201, 1, 20), (202, 1, 20);
Query OK, 2 rows affected (0.044 sec)
Records: 2  Duplicates: 0  Warnings: 0

MariaDB [alex_exp10]> INSERT INTO works_on (empid, project_no, hours) VALUES (1, 201, 20), (1, 202, 20), (2, 201, 20);
Query OK, 3 rows affected (0.042 sec)
Records: 3  Duplicates: 0  Warnings: 0

MariaDB [alex_exp10]> SELECT * FROM emp_proj;
+-------+--------------+-------------+
| empid | num_projects | total_hours |
+-------+--------------+-------------+
|     1 |            2 |          40 |
|     2 |            1 |          20 |
+-------+--------------+-------------+
2 rows in set (0.000 sec)

MariaDB [alex_exp10]> SELECT * FROM proj_info;
+------------+---------------+-------------+
| project_no | num_employees | total_hours |
+------------+---------------+-------------+
|        201 |             1 |          20 |
|        202 |             1 |          20 |
+------------+---------------+-------------+
2 rows in set (0.000 sec)

MariaDB [alex_exp10]> SELECT * FROM works_on;
+-------+------------+-------+
| empid | project_no | hours |
+-------+------------+-------+
|     1 |        201 |    20 |
|     1 |        202 |    20 |
|     2 |        201 |    20 |
+-------+------------+-------+
3 rows in set (0.000 sec)

MariaDB [alex_exp10]> -- Delete an entry from works_on to trigger updates in emp_proj and proj_info
MariaDB [alex_exp10]> DELETE FROM works_on WHERE empid = 1 AND project_no = 201;
Query OK, 1 row affected (0.047 sec)

MariaDB [alex_exp10]> SELECT * FROM emp_proj;
+-------+--------------+-------------+
| empid | num_projects | total_hours |
+-------+--------------+-------------+
|     1 |            1 |          20 |
|     2 |            1 |          20 |
+-------+--------------+-------------+
2 rows in set (0.000 sec)

MariaDB [alex_exp10]> SELECT * FROM proj_info;
+------------+---------------+-------------+
| project_no | num_employees | total_hours |
+------------+---------------+-------------+
|        201 |             0 |           0 |
|        202 |             1 |          20 |
+------------+---------------+-------------+
2 rows in set (0.000 sec)

MariaDB [alex_exp10]> SELECT * FROM works_on;
+-------+------------+-------+
| empid | project_no | hours |
+-------+------------+-------+
|     1 |        202 |    20 |
|     2 |        201 |    20 |
+-------+------------+-------+
2 rows in set (0.000 sec)

MariaDB [alex_exp10]> exit;
Bye
cclab@cclab-HP-280-G3-MT:/media/cclab/AGNELO/LAB PROGRAMS/DBMS/Experiment 10$ sudo /opt/lampp/bin/mysqldump alex_exp10 > alex_exp10.sql;
cclab@cclab-HP-280-G3-MT:/media/cclab/AGNELO/LAB PROGRAMS/DBMS/Experiment 10$ 

